{
  "generatedAt": "2026-10-23T13:05:00.000Z",
  "insights": {
    "generatedAt": "2026-10-23T13:00:00.000Z",
    "window": {
      "from": "2026-10-17",
      "through": "2026-10-23"
    },
    "errors": {
      "total": 46,
      "changePct": 38,
      "areas": [
        {
          "area": "Voice",
          "count": 19
        },
        {
          "area": "Sync",
          "count": 11
        },
        {
          "area": "Desktop helper",
          "count": 7
        },
        {
          "area": "Approvals",
          "count": 5
        }
      ],
      "lead": "One crash on locked screens causes 14 of the 19 voice events."
    },
    "feedback": {
      "total": 23,
      "people": 9,
      "agents": 14,
      "areas": [
        {
          "area": "Onboarding",
          "count": 8
        },
        {
          "area": "Speed",
          "count": 5
        },
        {
          "area": "Connectors",
          "count": 4
        }
      ],
      "lead": "People don’t know what to say to their first agent."
    },
    "journey": {
      "steps": [
        {
          "label": "Signed up",
          "count": 37
        },
        {
          "label": "Joined a workspace",
          "count": 30
        },
        {
          "label": "Messaged their free agent",
          "count": 11
        },
        {
          "label": "Free agent replied",
          "count": 11
        }
      ],
      "biggestDrop": {
        "label": "Messaged their free agent",
        "lost": 19
      }
    },
    "velocity": {
      "hoursLost": 31,
      "items": [
        {
          "label": "Flaky checks rerun by hand",
          "hours": 12
        },
        {
          "label": "Push limits hit on one PR",
          "hours": 10
        },
        {
          "label": "Reviews woken before checks",
          "hours": 9
        }
      ]
    },
    "links": [
      {
        "section": "feedback",
        "experimentId": "free-deepseek-agents"
      },
      {
        "section": "journey",
        "experimentId": "remove-onboarding-steps"
      }
    ]
  },
  "experiments": [
    {
      "id": "free-deepseek-agents",
      "title": "Free DeepSeek agents raise first replies",
      "source": {
        "section": "feedback",
        "text": "8 onboarding reports"
      },
      "change": "Give every new workspace a free DeepSeek agent",
      "metric": {
        "label": "Get an agent reply",
        "numerator": "firstReply",
        "denominator": "signups"
      },
      "before": {
        "value": 0.3,
        "samples": 37,
        "from": "2026-09-24",
        "through": "2026-10-23"
      },
      "predict": {
        "value": 0.5,
        "direction": "up"
      },
      "guardrail": "cap $25 a day",
      "decideAt": {
        "samples": 30,
        "date": "2026-11-20"
      },
      "ifUnclear": "undo",
      "status": "proposed",
      "approval": null,
      "startedOn": null,
      "progress": null,
      "verdict": null
    },
    {
      "id": "remove-onboarding-steps",
      "title": "Removing onboarding steps cuts drop-off",
      "source": {
        "section": "journey",
        "text": "19 people never message an agent"
      },
      "change": "Remove the onboarding steps between signup and the first workspace",
      "metric": {
        "label": "Reach a workspace",
        "numerator": "workspaces",
        "denominator": "signups"
      },
      "before": {
        "value": 0.81,
        "samples": 37,
        "from": "2026-09-24",
        "through": "2026-10-23"
      },
      "predict": {
        "value": 0.9,
        "direction": "up"
      },
      "guardrail": "First replies do not fall",
      "decideAt": {
        "samples": 30,
        "date": "2026-11-20"
      },
      "ifUnclear": "undo",
      "status": "proposed",
      "approval": null,
      "startedOn": null,
      "progress": null,
      "verdict": null
    },
    {
      "id": "fix-notices",
      "title": "Fix notices bring reporters back",
      "source": {
        "section": "feedback",
        "text": "Reporters rarely return after a fix"
      },
      "change": "Tell each reporter when their reported problem is fixed",
      "metric": {
        "label": "7-day return",
        "numerator": "feedback:returning-reporters",
        "denominator": "feedback:reporters"
      },
      "before": {
        "value": 0,
        "samples": 12,
        "from": "2026-09-15",
        "through": "2026-10-14"
      },
      "predict": {
        "value": 0.3,
        "direction": "up"
      },
      "guardrail": "No more than one notice per report",
      "decideAt": {
        "samples": 12,
        "date": "2026-11-11"
      },
      "ifUnclear": "keep",
      "status": "running",
      "approval": {
        "messageId": "placeholder-approval-message"
      },
      "startedOn": "2026-10-15",
      "progress": {
        "value": 0.25,
        "samples": 4,
        "asOf": "2026-10-23"
      },
      "verdict": null
    }
  ],
  "reach": {
    "month": "2026-10",
    "spent": 40,
    "cap": 200,
    "costPerSignup": null,
    "recommendations": [
      {
        "kind": "make",
        "channel": "YouTube",
        "title": "An agent fixes its own app",
        "detail": "YouTube Short, 45 s · we draft it together"
      },
      {
        "kind": "boost",
        "channel": "X",
        "title": "Oct 21 demo post",
        "detail": "$50 over 5 days · stop if no signups after $30"
      }
    ],
    "posts": [
      {
        "title": "Agents ship a fix",
        "channel": "YouTube",
        "date": "2026-10-18",
        "views": 2400,
        "clicks": 61,
        "spend": 40,
        "status": "boosting"
      },
      {
        "title": "Demo: one Room",
        "channel": "X",
        "date": "2026-10-21",
        "views": 5100,
        "clicks": 88,
        "spend": 0,
        "status": "organic"
      },
      {
        "title": "Voice agent intro",
        "channel": "X",
        "date": "2026-10-09",
        "views": 900,
        "clicks": 4,
        "spend": 0,
        "status": "organic"
      }
    ]
  },
  "digests": [
    {
      "date": "2026-10-23",
      "title": "Voice crash leads errors; onboarding drop is the top pain",
      "findings": 2,
      "proposals": 1,
      "path": "digests/2026-10-23.md"
    },
    {
      "date": "2026-10-22",
      "title": "Endless-spinner fix merged; Play reports still refused",
      "findings": 2,
      "proposals": 0,
      "path": "digests/2026-10-22.md"
    },
    {
      "date": "2026-10-21",
      "title": "Turn failures spiked to 10%",
      "findings": 3,
      "proposals": 1,
      "path": "digests/2026-10-21.md"
    },
    {
      "date": "2026-10-20",
      "title": "First iOS downloads counted",
      "findings": 1,
      "proposals": 0,
      "path": "digests/2026-10-20.md"
    }
  ]
}
